<?xml version="1.0" encoding="UTF-8"?>
<!ELEMENT Students_Info (student+)>
<!ELEMENT student (name,id,avg,dob,time,mobile,distinction)>
<!ELEMENT name (#PCDATA)>
<!ELEMENT id (#PCDATA)>
<!ELEMENT avg (#PCDATA)>
<!ELEMENT dob (#PCDATA)>
<!ELEMENT time (#PCDATA)>
<!ELEMENT mobile (#PCDATA)>
<!ELEMENT distinction (#PCDATA)>